StartDate,EndDate,Status,IPAddress,Progress,Duration (in seconds),Finished,RecordedDate,ResponseId,RecipientLastName,RecipientFirstName,RecipientEmail,ExternalReference,LocationLatitude,LocationLongitude,DistributionChannel,UserLanguage,xA,xB,ABS,ABL,free_response,sex,race,age,education,income,science,intuition,god,SC0,free_response - Topics
8/29/17 16:14,8/29/17 16:16,0,67.48.180.254,100,74,1,8/29/17 16:16,R_3dSsQVZyHqwqFri,,,,,37.75100708,-97.8219986,anonymous,EN,,4,,,because it could  reduce accidents and people should be doing this already,1,2,27,3,2,4,4,5,11,Unknown
8/29/17 16:00,8/29/17 16:16,0,70.188.200.68,100,954,1,8/29/17 16:16,R_29lWUCspIKmBkMh,,,,,33.59089661,-112.3311005,anonymous,EN,,4,,,I think this will set everyone's mind at ease when it comes to welcoming self-driving cars. By having limitations of the cars by implementing sensors in order to stop and react will help decrease the casualties in high traffic situations. ,2,2,27,4,3,4,3,3,8,Unknown
8/29/17 16:15,8/29/17 16:19,0,76.188.59.169,100,206,1,8/29/17 16:19,R_Dl6UObVPb6upAFX,,,,,41.85279846,-80.79049683,anonymous,EN,,,,3,"I dont think technology will ultimately benefit mankind. It could be a part in our end. It needs to serve a practical purpose, I believe for the individual and society as a whole, but when is enough--Enough? Gets to a point where man plays God or wishes to be his own god. Heaven forfend people just keep driving like we have been for 100 years..",1,3,43,3,5,2,5,5,14,Unknown
8/29/17 16:18,8/29/17 16:19,0,174.227.5.43,100,49,1,8/29/17 16:19,R_2bWvpz2njoSGlV2,,,,,28.63439941,-81.62210083,anonymous,EN,,,4,,Best way of figuring it out ,1,3,22,4,3,5,1,1,3,Unknown
8/29/17 16:16,8/29/17 16:20,0,50.88.242.227,100,250,1,8/29/17 16:20,R_cFIGCocU8J6fbfX,,,,,28.53410339,-81.16470337,anonymous,EN,2,,,,"There are many people who do in fact accelerate when it turns yellow so they can run it before it turns red. If they can set it so it does accelerate DEPENDING on the speed of the car, distance, etc then it might be ok to do",1,"2,4",20,2,4,5,4,1,6,Unknown
8/29/17 16:18,8/29/17 16:20,0,69.114.28.19,100,135,1,8/29/17 16:20,R_2fdrwNO4ODXR2TE,,,,,40.59609985,-73.97319794,anonymous,EN,,,,1,The testing to see which measure should be done within more constricted parameters. It is extremely wrong to use the public as guinea pigs.,2,1,34,4,4,5,1,1,3,Unknown
8/29/17 16:17,8/29/17 16:21,0,208.107.95.13,100,189,1,8/29/17 16:21,R_BKABDzhno2E6AOl,,,,,43.47109985,-96.59700012,anonymous,EN,,4,,,"If there is time to stop  before a light once the light turns yellow, a car should stop.",2,3,31,4,2,4,3,4,9,Unknown
8/29/17 16:20,8/29/17 16:21,0,184.88.199.100,100,104,1,8/29/17 16:21,R_b3ePlcoHUL3nSP7,,,,,29.23699951,-81.05799866,anonymous,EN,1,,,,Because you are supposed to slow down at a yellow light and speeding up could cause you to run into the car in front of you,2,3,38,3,2,5,1,1,3,Unknown
8/29/17 16:19,8/29/17 16:22,0,73.81.148.125,100,150,1,8/29/17 16:22,R_rkVtchj2ZqCcwMN,,,,,40.06359863,-75.07969666,anonymous,EN,,5,,,It is much safer to slow down and stop at a yellow light when it is detected then risk running a red light and being in an accident possibly. ,1,3,31,2,1,4,2,2,6,Unknown
8/29/17 16:21,8/29/17 16:23,0,173.239.240.82,100,151,1,8/29/17 16:23,R_2rUeee6IwXz23b7,,,,,41.84829712,-87.65170288,anonymous,EN,,,4,,I agree it will help avoid accidents.,2,3,33,3,4,4,3,4,9,Unknown
8/29/17 16:21,8/29/17 16:25,0,12.219.73.130,100,227,1,8/29/17 16:25,R_2sZ9DWl8WC5uOgE,,,,,30.4223938,-88.65270233,anonymous,EN,,,,2,i feel that its somewhat inappropriate because you are utilizing test at the cost of one of the many drivers on the road with these cards...,2,1,25,3,2,5,3,4,8,Unknown
8/29/17 16:26,8/29/17 16:28,0,76.202.82.188,100,78,1,8/29/17 16:28,R_1mOEiapOXoZRCit,,,,,33.29060364,-84.26589966,anonymous,EN,1,,,,Running yellow lights are technically illegal and a traffic violation.,2,"1,2,3",21,3,5,4,3,5,10,Unknown
8/29/17 16:24,8/29/17 16:28,0,75.184.0.126,100,236,1,8/29/17 16:28,R_3ee5MW2rvcrrCo1,,,,,35.05700684,-79.01470184,anonymous,EN,1,,,,It is reckless dangerous and totally irresponsible  to accelerate on a yellow light to many accidents and even deaths can and would occur.His comment decision was totally inappropriate. ,2,3,70,6,2,4,5,5,12,Unknown
8/29/17 16:24,8/29/17 16:29,0,24.20.152.4,100,321,1,8/29/17 16:29,R_123eJAvR6ZDS7d2,,,,,45.45730591,-122.7991943,anonymous,EN,,,,1,He should test this setting and perfect it before the cars are out in the public instead of during the first year. This seems inappropriate and irresponsible to me.,1,3,27,4,2,4,2,4,8,Unknown
8/29/17 16:29,8/29/17 16:30,0,142.129.109.174,100,98,1,8/29/17 16:30,R_2SucXJEqbkdXR9p,,,,,34.07640076,-118.2626038,anonymous,EN,,5,,,He took into account how what was the best way to be safe. SO his choose was justicifyed if it helped,2,1,32,4,4,4,3,3,8,Unknown
8/29/17 16:31,8/29/17 16:33,0,98.118.25.232,100,102,1,8/29/17 16:33,R_1dugXc746ChzOhF,,,,,42.0796051,-71.03820038,anonymous,EN,1,,,,I do not feel that this the safest way to handle the problem.,2,3,36,6,6,4,3,3,8,Unknown
8/29/17 16:32,8/29/17 16:33,0,50.96.247.214,100,94,1,8/29/17 16:33,R_2WBY8inRLNdWx3m,,,,,42.10450745,-79.2519989,anonymous,EN,,5,,,"Your supposed to slow down when you see a yellow light as it is now, not speed through it to miss the red",2,3,38,3,4,5,1,1,3,Unknown
8/29/17 16:32,8/29/17 16:33,0,108.34.207.250,100,109,1,8/29/17 16:33,R_1outtaEtRQsQTan,,,,,41.86849976,-71.39279938,anonymous,EN,,,,1,Because the decision to have automated cars accelerating towards stop lights is very dangerous and unethical. It puts the public at risk for company profits. ,1,3,30,4,4,5,1,2,4,Unknown
8/29/17 16:34,8/29/17 16:38,0,71.88.206.115,100,239,1,8/29/17 16:38,R_3no8AzeLOU9RDtk,,,,,36.4907074,-82.62000275,anonymous,EN,,,,4,"If the cars are going to be on the road anyway, it is appropriate that the experiment is being done. It is best to see which way causes fewer accidents. ",2,3,31,3,3,5,1,1,3,Unknown
8/29/17 16:41,8/29/17 16:45,0,216.128.252.71,100,212,1,8/29/17 16:45,R_2DUpAC2k9mzUMph,,,,,33.52070618,-86.80249786,anonymous,EN,,5,,,"This is the conservative approach, which I always prefer. The most important factor is passenger safety. If it is standard for self-driving cars to stop at yellow lights, this essentially eliminates the possibility of side impact at intersections. The inconvenience is minimal - A human could also choose to stop at yellow lights just the same, and it will only delay the passenger minutes at most.",2,3,26,4,5,5,1,1,3,Unknown
8/29/17 16:46,8/29/17 16:48,0,192.209.17.137,100,132,1,8/29/17 16:48,R_sZ1Q7WSF2wS6NdT,,,,,35.31900024,-86.60720062,anonymous,EN,4,,,,"This should help as the drivers behind the self-driving car will lessen the chances of hitting the cars if they accelerate at the light, while the self-driving car stops at the light. If the self-driving car accelerates and goes through yellow lights, it will have less likely rear end collisions.",2,3,39,2,4,5,4,4,9,Unknown